{
  "schemaVersion": 1,
  "contractVersion": 2,
  "registry": "assets/design-system/pixso-component-registry.json",
  "canonicalAttributes": {
    "componentId": "data-component",
    "logicalName": "data-logical-component",
    "variant": "data-variant",
    "state": "data-state"
  },
  "connectionModes": {
    "source-component": {
      "strictEligible": true,
      "description": "A first-party framework component renders the canonical contract from props and state."
    },
    "third-party-wrapper": {
      "strictEligible": true,
      "description": "A first-party wrapper translates a third-party component into the canonical contract."
    },
    "compiled-runtime-fallback": {
      "strictEligible": false,
      "description": "A runtime adapter annotates compiled output. It can prove visual Token coverage but not source component reuse."
    }
  },
  "frameworks": {
    "react": {
      "sourceExtensions": [".jsx", ".tsx"],
      "stateSource": "props-and-state",
      "nextAlias": true,
      "requiredAttributes": [
        "data-component",
        "data-logical-component",
        "data-variant",
        "data-state"
      ]
    },
    "vue": {
      "sourceExtensions": [".vue"],
      "stateSource": "props-and-reactivity",
      "requiredAttributes": [
        "data-component",
        "data-logical-component",
        "data-variant",
        "data-state"
      ]
    },
    "html": {
      "sourceExtensions": [".html"],
      "stateSource": "attributes-and-script",
      "requiredAttributes": [
        "data-component",
        "data-logical-component",
        "data-variant",
        "data-state"
      ]
    }
  },
  "styleEngines": {
    "tailwind": {
      "role": "implementation-only",
      "forbidAsContractSource": true,
      "forbidArbitraryVisibleValues": true,
      "requiredValueSource": "canonical-css-custom-properties"
    }
  },
  "strictDelivery": {
    "requireFrameworkSourceEvidence": true,
    "requireRegisteredLogicalName": true,
    "requirePixsoLinkedInstance": true,
    "requireInstanceSafeContent": true,
    "forbidRuntimeFallback": true,
    "forbidDetachedPixsoComponents": true,
    "forbidComponentColorFindings": true,
    "forbidComponentContentFindings": true
  }
}
